{
  "id": "qwen",
  "name": "通义千问",
  "base_url": "https://dashscope.aliyuncs.com/compatible-mode/v1",
  "api_key_env": "DASHSCOPE_API_KEY",
  "models_endpoint": "/models",
  "chat_endpoint": "/chat/completions",
  "default_model": "qwen-turbo",
  "supports_streaming": true,
  "supports_function_calling": true,
  "headers": {
    "Authorization": "Bearer ${api_key}"
  },
  "models": [
    {"id": "qwen-turbo", "name": "通义千问 Turbo", "context_window": 131072, "max_output_tokens": 8192},
    {"id": "qwen-plus", "name": "通义千问 Plus", "context_window": 131072, "max_output_tokens": 8192},
    {"id": "qwen-max", "name": "通义千问 Max", "context_window": 32768, "max_output_tokens": 8192},
    {"id": "qwen-long", "name": "通义千问 Long", "context_window": 10000000, "max_output_tokens": 6000}
  ]
}
